{
  "schema_version": "attach-open-score/v0",
  "policy_profile": "local-dev-default",
  "engine_version": "v0-draft",
  "package": {
    "ecosystem": "pypi",
    "name": "synthetic-vulnerable-package",
    "version": "2.0.0",
    "purl": "pkg:pypi/synthetic-vulnerable-package@2.0.0",
    "resolved": true
  },
  "decision": "DENY",
  "score": 96,
  "confidence": "HIGH",
  "reasons": [
    {
      "code": "KNOWN_VULNERABILITY_CRITICAL",
      "severity": "CRITICAL",
      "decision_effect": "DENY",
      "message": "Synthetic fixture: evaluated version is affected by a critical advisory from an allowed-source-style record.",
      "source_ref_ids": [
        "synthetic-ghsa-critical"
      ],
      "details": {
        "advisory_id": "GHSA-synth-crit-0001",
        "cvss": "critical",
        "fixture": "synthetic"
      }
    }
  ],
  "source_refs": [
    {
      "id": "synthetic-ghsa-critical",
      "source": "synthetic-github-advisory-database",
      "source_id": "GHSA-synth-crit-0001",
      "url": "https://example.invalid/advisories/GHSA-synth-crit-0001",
      "retrieved_at": "2026-05-05T00:00:00Z",
      "ttl_seconds": 86400,
      "license_or_terms_url": "https://example.invalid/terms",
      "attribution": "Synthetic GHSA-style advisory fixture; not real upstream data.",
      "attribution_required": false,
      "redistribution": "allowed",
      "public_display": "allowed"
    }
  ],
  "evaluated_at": "2026-05-05T00:00:00Z",
  "ttl_seconds": 86400,
  "limitations": [
    "Synthetic fixture; not a real package evaluation."
  ]
}
