{
  "schema_version": "attach-open-score/v0",
  "policy_profile": "local-dev-default",
  "engine_version": "v0-draft",
  "package": {
    "ecosystem": "npm",
    "name": "synthetic-stale-release",
    "version": "4.2.0",
    "purl": "pkg:npm/synthetic-stale-release@4.2.0",
    "requested_spec": "latest",
    "resolved": true
  },
  "decision": "ASK",
  "score": 45,
  "confidence": "MEDIUM",
  "reasons": [
    {
      "code": "RELEASE_RECENCY_STALE",
      "severity": "MEDIUM",
      "decision_effect": "ASK",
      "message": "Synthetic fixture: last observed release is older than the default stale-release threshold.",
      "source_ref_ids": [
        "synthetic-registry-release"
      ],
      "details": {
        "last_release_at": "2024-05-01T00:00:00Z",
        "age_days": 734,
        "stale_after_days": 730,
        "fresh_within_days": 365,
        "fixture": "synthetic"
      }
    }
  ],
  "source_refs": [
    {
      "id": "synthetic-registry-release",
      "source": "synthetic-registry",
      "source_id": "synthetic-stale-release@4.2.0",
      "url": "https://example.invalid/registry/synthetic-stale-release/4.2.0",
      "retrieved_at": "2026-05-05T00:00:00Z",
      "ttl_seconds": 86400,
      "license_or_terms_url": "https://example.invalid/terms",
      "attribution": "Synthetic registry release metadata fixture; not real upstream data.",
      "attribution_required": false,
      "redistribution": "allowed",
      "public_display": "allowed"
    }
  ],
  "evaluated_at": "2026-05-05T00:00:00Z",
  "ttl_seconds": 86400,
  "limitations": [
    "Synthetic fixture; not a real package evaluation.",
    "Release recency is a deterministic review signal, not evidence of malicious behavior by itself."
  ]
}
