{
  "schema_version": "attach-open-score/v0",
  "policy_profile": "local-dev-default",
  "engine_version": "v0-draft",
  "package": {
    "ecosystem": "npm",
    "name": "synthetic-clean-package",
    "version": "1.2.3",
    "purl": "pkg:npm/synthetic-clean-package@1.2.3",
    "requested_spec": "^1.2.0",
    "resolved": true,
    "repository_url": "https://example.invalid/synthetic-clean-package"
  },
  "decision": "ALLOW",
  "score": 8,
  "confidence": "MEDIUM",
  "reasons": [
    {
      "code": "NO_KNOWN_VULNERABILITIES",
      "severity": "INFO",
      "decision_effect": "NONE",
      "message": "Synthetic fixture: checked allowed vulnerability sources found no matching advisory.",
      "source_ref_ids": [
        "synthetic-osv-no-hit"
      ],
      "details": {
        "fixture": "synthetic",
        "real_package": false
      }
    }
  ],
  "source_refs": [
    {
      "id": "synthetic-osv-no-hit",
      "source": "synthetic-osv.dev",
      "source_id": "synthetic-no-hit",
      "url": "https://example.invalid/osv/synthetic-no-hit",
      "retrieved_at": "2026-05-05T00:00:00Z",
      "ttl_seconds": 86400,
      "license_or_terms_url": "https://example.invalid/terms",
      "attribution": "Synthetic fixture modeled after OSV-style no-hit response; not real upstream data.",
      "attribution_required": false,
      "redistribution": "allowed",
      "public_display": "allowed"
    }
  ],
  "evaluated_at": "2026-05-05T00:00:00Z",
  "ttl_seconds": 86400,
  "limitations": [
    "Synthetic fixture; not a real package evaluation.",
    "Absence of known vulnerabilities is not proof of safety."
  ]
}
